{
  "name": "hep-research",
  "version": "0.1.0",
  "description": "Optional discovery of HEP literature, publication records, documents, and public result data.",
  "author": {
    "name": "LHCb Agent Marketplace contributors",
    "url": "https://github.com/MohamedElashri"
  },
  "license": "MIT",
  "keywords": [
    "HEP",
    "INSPIRE-HEP",
    "HEPData",
    "CDS",
    "literature",
    "open data"
  ]
}
